{
  "$schema": "https://json-schema.org/draft/2020-12/schema",
  "$id": "urn:libredi:schema:edifact-overrides",
  "title": "EDIFACT partner overrides",
  "description": "The rules a trading partner, or one flow with a partner, changes in the standard definitions of an EDIFACT directory, without editing the registry (contracts/registry): stricter or looser data elements, positions made mandatory or conditional, code-list additions and removals, structure cardinalities and issue severities. A document is for one directory and applies to the messages of that directory; several documents are applied in order, the last one winning. Unlike the other contracts its objects are closed: a misspelt or unknown property is an error, not a rule that is silently not applied. Rules that need the registry, such as a position that must exist, are listed in contracts/overrides/README.md.",
  "type": "object",
  "required": ["schemaVersion", "directory"],
  "additionalProperties": false,
  "properties": {
    "$schema": {
      "description": "The schema this document follows, for editors. Never read by a program.",
      "type": "string"
    },
    "schemaVersion": {
      "description": "Version of this format. Readers refuse a version they do not know.",
      "type": "integer",
      "const": 1
    },
    "name": {
      "description": "A name for people: the partner and the flow, for example \"Acme orders from Retailer\". Never read by a program.",
      "type": "string",
      "minLength": 1,
      "maxLength": 200
    },
    "description": {
      "description": "Why the rules are there. Never read by a program.",
      "type": "string",
      "maxLength": 2000
    },
    "directory": {
      "description": "The directory the document is for, as the registry gives it (the three parts of S009 of UNH). The document changes the registry of this directory and no other.",
      "type": "object",
      "required": ["agency", "version", "release"],
      "additionalProperties": false,
      "properties": {
        "agency": {
          "type": "string",
          "pattern": "^[A-Z0-9]{1,3}$"
        },
        "version": {
          "type": "string",
          "pattern": "^[A-Z0-9]{1,3}$"
        },
        "release": {
          "type": "string",
          "pattern": "^[A-Z0-9]{1,3}$"
        }
      }
    },
    "dataElements": {
      "description": "Rules of simple data elements, by tag. A property that is given replaces the one of the registry; the others stay. Every use of the element is changed, in every segment and composite.",
      "type": "object",
      "propertyNames": {
        "$ref": "#/$defs/dataElementTag"
      },
      "additionalProperties": {
        "description": "What changes in a data element.",
        "type": "object",
        "minProperties": 1,
        "additionalProperties": false,
        "properties": {
          "type": {
            "description": "a: alphabetic, n: numeric, an: alphanumeric.",
            "enum": ["a", "an", "n"]
          },
          "minLength": {
            "description": "Fewest characters in a value.",
            "type": "integer",
            "minimum": 1
          },
          "maxLength": {
            "description": "Most characters in a value.",
            "type": "integer",
            "minimum": 1
          }
        }
      }
    },
    "composites": {
      "description": "Rules of composite data elements, by tag. A composite is shared by every segment that uses it, so a change applies wherever it is used.",
      "type": "object",
      "propertyNames": {
        "$ref": "#/$defs/compositeTag"
      },
      "additionalProperties": {
        "type": "object",
        "required": ["components"],
        "additionalProperties": false,
        "properties": {
          "components": {
            "description": "Components by position, counted from 1.",
            "type": "object",
            "propertyNames": {
              "$ref": "#/$defs/position"
            },
            "additionalProperties": {
              "type": "object",
              "required": ["status"],
              "additionalProperties": false,
              "properties": {
                "status": {
                  "description": "M makes the component mandatory where its composite is present, C makes it conditional.",
                  "enum": ["M", "C"]
                }
              }
            }
          }
        }
      }
    },
    "segments": {
      "description": "Rules of the positions of segments, by tag. The change applies wherever the segment is used.",
      "type": "object",
      "propertyNames": {
        "$ref": "#/$defs/segmentTag"
      },
      "additionalProperties": {
        "type": "object",
        "required": ["elements"],
        "additionalProperties": false,
        "properties": {
          "elements": {
            "description": "Elements by position, counted from 1; an empty element counts and a composite counts as one.",
            "type": "object",
            "propertyNames": {
              "$ref": "#/$defs/position"
            },
            "additionalProperties": {
              "description": "What changes in a position of a segment.",
              "type": "object",
              "minProperties": 1,
              "additionalProperties": false,
              "properties": {
                "status": {
                  "description": "M: mandatory, at least one occurrence. C: conditional, may be absent.",
                  "enum": ["M", "C"]
                },
                "maxOccurs": {
                  "description": "Largest number of repetitions of the element (syntax version 4).",
                  "type": "integer",
                  "minimum": 1
                }
              }
            }
          }
        }
      }
    },
    "codeLists": {
      "description": "Changes to code lists, by identifier.",
      "type": "object",
      "propertyNames": {
        "$ref": "#/$defs/codeListId"
      },
      "additionalProperties": {
        "description": "What changes in a code list.",
        "type": "object",
        "minProperties": 1,
        "additionalProperties": false,
        "properties": {
          "closed": {
            "description": "true: the list holds every valid value, so another value is an error. false: it is only what the directory knows, so another value is at most a warning, and only when the validator is run with all the code lists. Added and removed codes only change what is enforced on a list that is closed.",
            "type": "boolean"
          },
          "add": {
            "description": "Codes the partner uses that the list does not have, by code. Has an effect on a closed list (or an open one when the validator checks all lists).",
            "type": "object",
            "minProperties": 1,
            "propertyNames": {
              "type": "string",
              "minLength": 1,
              "maxLength": 35
            },
            "additionalProperties": {
              "type": "object",
              "additionalProperties": false,
              "properties": {
                "name": {
                  "type": "string",
                  "minLength": 1
                },
                "description": {
                  "type": "string"
                }
              }
            }
          },
          "remove": {
            "description": "Codes the partner does not accept. Has an effect on a closed list (or an open one when the validator checks all lists).",
            "type": "array",
            "minItems": 1,
            "uniqueItems": true,
            "items": {
              "type": "string",
              "minLength": 1,
              "maxLength": 35
            }
          }
        }
      }
    },
    "messages": {
      "description": "Changes to message structures, by message type.",
      "type": "object",
      "propertyNames": {
        "$ref": "#/$defs/messageType"
      },
      "additionalProperties": {
        "type": "object",
        "required": ["nodes"],
        "additionalProperties": false,
        "properties": {
          "nodes": {
            "description": "Nodes of the structure, selected by a TAG (every segment node of that tag, at any depth), by a group identifier SGn (that group) or by SGn/TAG (the segment nodes of that tag directly inside that group). Where several selectors match one node, each property comes from the most specific one: SGn/TAG over TAG.",
            "type": "object",
            "propertyNames": {
              "$ref": "#/$defs/selector"
            },
            "additionalProperties": {
              "description": "What changes in a node. For a group it is the group, not its trigger.",
              "type": "object",
              "minProperties": 1,
              "additionalProperties": false,
              "properties": {
                "status": {
                  "description": "M: mandatory, at least one occurrence. C: conditional, may be absent.",
                  "enum": ["M", "C"]
                },
                "maxOccurs": {
                  "description": "Largest number of occurrences allowed.",
                  "type": "integer",
                  "minimum": 1
                }
              }
            }
          }
        }
      }
    },
    "severity": {
      "description": "The severity of an issue, by code: error, warning, or off, which drops the issue. A code is changed wherever the validator finds it, in every layer that uses it (MISSING_MANDATORY_ELEMENT and INVALID_DATA_TYPE are also found in the envelope segments). The codes of the files that cannot be read (layer tokenizer) cannot be changed.",
      "type": "object",
      "propertyNames": {
        "enum": [
          "ELEMENT_REPEATED_TOO_OFTEN",
          "INVALID_DATA_TYPE",
          "MESSAGE_NOT_CHECKED",
          "MISSING_ENVELOPE_SEGMENT",
          "MISSING_MANDATORY_ELEMENT",
          "MISSING_MANDATORY_SEGMENT",
          "REPETITION_NOT_ALLOWED",
          "SEGMENT_OUT_OF_ORDER",
          "TOO_MANY_REPETITIONS",
          "UNEXPECTED_COMPONENT",
          "UNEXPECTED_ELEMENT",
          "UNEXPECTED_SEGMENT",
          "UNE_COUNT_MISMATCH",
          "UNE_REFERENCE_MISMATCH",
          "UNKNOWN_CODE",
          "UNKNOWN_SEGMENT",
          "UNSUPPORTED_SYNTAX_VERSION",
          "UNT_COUNT_MISMATCH",
          "UNT_REFERENCE_MISMATCH",
          "UNZ_COUNT_MISMATCH",
          "UNZ_REFERENCE_MISMATCH",
          "VALUE_TOO_LONG",
          "VALUE_TOO_SHORT"
        ]
      },
      "additionalProperties": {
        "enum": ["error", "warning", "off"]
      }
    }
  },
  "$defs": {
    "dataElementTag": {
      "type": "string",
      "pattern": "^[0-9]{4}$"
    },
    "compositeTag": {
      "type": "string",
      "pattern": "^[CS][0-9]{3}$"
    },
    "segmentTag": {
      "type": "string",
      "pattern": "^[A-Z]{3}$"
    },
    "messageType": {
      "type": "string",
      "pattern": "^[A-Z]{6}$"
    },
    "codeListId": {
      "type": "string",
      "pattern": "^[A-Za-z0-9][A-Za-z0-9._-]{0,31}$"
    },
    "position": {
      "description": "A position, counted from 1.",
      "type": "string",
      "pattern": "^[1-9][0-9]{0,2}$"
    },
    "selector": {
      "type": "string",
      "pattern": "^(SG[0-9]+/[A-Z]{3}|SG[0-9]+|[A-Z]{3})$"
    }
  }
}
